{
  "schema_version": 1,
  "dataset_id": "map.deluxe2015.world",
  "content_version": "0.1.0",
  "ruleset_id": "ruleset.deluxe2015",
  "scope": "release-candidate",
  "description": "Deluxe基础地图：按六主地区排列的84个国家、子区、规则邻接和超级大国边；不含初始布置、坐标、贴图或对局状态。",
  "source_catalog": [
    {
      "id": "M-DELUXE",
      "url": "https://s3-us-west-2.amazonaws.com/gmtwebsiteassets/nnts/TSMap11.jpg",
      "edition": "GMT Deluxe map, printed copyright 2009",
      "description": "国家名框、稳定度、战场底色、地区色及实线/虚线规则邻接；不采用可选中国内战框。"
    },
    {
      "id": "R2015",
      "url": "https://www.gmtgames.com/nnts/TS_Rules-2015.pdf",
      "edition": "Deluxe rules 2015",
      "description": "§2.1地图与子区语义；§2.2卡牌印刷标记；§9中国牌特殊生命周期。"
    }
  ],
  "regions": [
    {
      "id": "region.europe",
      "kind": "ScoringRegion",
      "parent_id": null,
      "name_key": "region.europe.name",
      "source_refs": [
        {
          "source_id": "M-DELUXE",
          "locator": "Europe region colors/legend",
          "verification": "Verified"
        },
        {
          "source_id": "R2015",
          "locator": "§2.1.1–2.1.2",
          "verification": "Verified"
        }
      ]
    },
    {
      "id": "region.asia",
      "kind": "ScoringRegion",
      "parent_id": null,
      "name_key": "region.asia.name",
      "source_refs": [
        {
          "source_id": "M-DELUXE",
          "locator": "Asia region colors/legend",
          "verification": "Verified"
        },
        {
          "source_id": "R2015",
          "locator": "§2.1.1–2.1.2",
          "verification": "Verified"
        }
      ]
    },
    {
      "id": "region.middle_east",
      "kind": "ScoringRegion",
      "parent_id": null,
      "name_key": "region.middle_east.name",
      "source_refs": [
        {
          "source_id": "M-DELUXE",
          "locator": "Middle East region colors/legend",
          "verification": "Verified"
        },
        {
          "source_id": "R2015",
          "locator": "§2.1.1–2.1.2",
          "verification": "Verified"
        }
      ]
    },
    {
      "id": "region.africa",
      "kind": "ScoringRegion",
      "parent_id": null,
      "name_key": "region.africa.name",
      "source_refs": [
        {
          "source_id": "M-DELUXE",
          "locator": "Africa region colors/legend",
          "verification": "Verified"
        },
        {
          "source_id": "R2015",
          "locator": "§2.1.1–2.1.2",
          "verification": "Verified"
        }
      ]
    },
    {
      "id": "region.central_america",
      "kind": "ScoringRegion",
      "parent_id": null,
      "name_key": "region.central_america.name",
      "source_refs": [
        {
          "source_id": "M-DELUXE",
          "locator": "Central America region colors/legend",
          "verification": "Verified"
        },
        {
          "source_id": "R2015",
          "locator": "§2.1.1–2.1.2",
          "verification": "Verified"
        }
      ]
    },
    {
      "id": "region.south_america",
      "kind": "ScoringRegion",
      "parent_id": null,
      "name_key": "region.south_america.name",
      "source_refs": [
        {
          "source_id": "M-DELUXE",
          "locator": "South America region colors/legend",
          "verification": "Verified"
        },
        {
          "source_id": "R2015",
          "locator": "§2.1.1–2.1.2",
          "verification": "Verified"
        }
      ]
    },
    {
      "id": "region.eastern_europe",
      "kind": "Subregion",
      "parent_id": "region.europe",
      "name_key": "region.eastern_europe.name",
      "source_refs": [
        {
          "source_id": "M-DELUXE",
          "locator": "Eastern Europe region colors/legend",
          "verification": "Verified"
        },
        {
          "source_id": "R2015",
          "locator": "§2.1.1–2.1.2",
          "verification": "Verified"
        }
      ]
    },
    {
      "id": "region.western_europe",
      "kind": "Subregion",
      "parent_id": "region.europe",
      "name_key": "region.western_europe.name",
      "source_refs": [
        {
          "source_id": "M-DELUXE",
          "locator": "Western Europe region colors/legend",
          "verification": "Verified"
        },
        {
          "source_id": "R2015",
          "locator": "§2.1.1–2.1.2",
          "verification": "Verified"
        }
      ]
    },
    {
      "id": "region.southeast_asia",
      "kind": "Subregion",
      "parent_id": "region.asia",
      "name_key": "region.southeast_asia.name",
      "source_refs": [
        {
          "source_id": "M-DELUXE",
          "locator": "Southeast Asia region colors/legend",
          "verification": "Verified"
        },
        {
          "source_id": "R2015",
          "locator": "§2.1.1–2.1.2",
          "verification": "Verified"
        }
      ]
    }
  ],
  "countries": [
    {
      "id": "country.canada",
      "name_key": "country.canada.name",
      "stability": 4,
      "base_battleground": false,
      "primary_region_id": "region.europe",
      "subregion_ids": [
        "region.western_europe"
      ],
      "source_refs": [
        {
          "source_id": "M-DELUXE",
          "locator": "Europe / Canada box: stability, battleground title, region colors",
          "verification": "Verified"
        }
      ]
    },
    {
      "id": "country.uk",
      "name_key": "country.uk.name",
      "stability": 5,
      "base_battleground": false,
      "primary_region_id": "region.europe",
      "subregion_ids": [
        "region.western_europe"
      ],
      "source_refs": [
        {
          "source_id": "M-DELUXE",
          "locator": "Europe / United Kingdom box: stability, battleground title, region colors",
          "verification": "Verified"
        }
      ]
    },
    {
      "id": "country.norway",
      "name_key": "country.norway.name",
      "stability": 4,
      "base_battleground": false,
      "primary_region_id": "region.europe",
      "subregion_ids": [
        "region.western_europe"
      ],
      "source_refs": [
        {
          "source_id": "M-DELUXE",
          "locator": "Europe / Norway box: stability, battleground title, region colors",
          "verification": "Verified"
        }
      ]
    },
    {
      "id": "country.sweden",
      "name_key": "country.sweden.name",
      "stability": 4,
      "base_battleground": false,
      "primary_region_id": "region.europe",
      "subregion_ids": [
        "region.western_europe"
      ],
      "source_refs": [
        {
          "source_id": "M-DELUXE",
          "locator": "Europe / Sweden box: stability, battleground title, region colors",
          "verification": "Verified"
        }
      ]
    },
    {
      "id": "country.finland",
      "name_key": "country.finland.name",
      "stability": 4,
      "base_battleground": false,
      "primary_region_id": "region.europe",
      "subregion_ids": [
        "region.eastern_europe",
        "region.western_europe"
      ],
      "source_refs": [
        {
          "source_id": "M-DELUXE",
          "locator": "Europe / Finland box: stability, battleground title, region colors",
          "verification": "Verified"
        }
      ]
    },
    {
      "id": "country.denmark",
      "name_key": "country.denmark.name",
      "stability": 3,
      "base_battleground": false,
      "primary_region_id": "region.europe",
      "subregion_ids": [
        "region.western_europe"
      ],
      "source_refs": [
        {
          "source_id": "M-DELUXE",
          "locator": "Europe / Denmark box: stability, battleground title, region colors",
          "verification": "Verified"
        }
      ]
    },
    {
      "id": "country.benelux",
      "name_key": "country.benelux.name",
      "stability": 3,
      "base_battleground": false,
      "primary_region_id": "region.europe",
      "subregion_ids": [
        "region.western_europe"
      ],
      "source_refs": [
        {
          "source_id": "M-DELUXE",
          "locator": "Europe / Benelux box: stability, battleground title, region colors",
          "verification": "Verified"
        }
      ]
    },
    {
      "id": "country.france",
      "name_key": "country.france.name",
      "stability": 3,
      "base_battleground": true,
      "primary_region_id": "region.europe",
      "subregion_ids": [
        "region.western_europe"
      ],
      "source_refs": [
        {
          "source_id": "M-DELUXE",
          "locator": "Europe / France box: stability, battleground title, region colors",
          "verification": "Verified"
        }
      ]
    },
    {
      "id": "country.spain_portugal",
      "name_key": "country.spain_portugal.name",
      "stability": 2,
      "base_battleground": false,
      "primary_region_id": "region.europe",
      "subregion_ids": [
        "region.western_europe"
      ],
      "source_refs": [
        {
          "source_id": "M-DELUXE",
          "locator": "Europe / Spain/Portugal box: stability, battleground title, region colors",
          "verification": "Verified"
        }
      ]
    },
    {
      "id": "country.italy",
      "name_key": "country.italy.name",
      "stability": 2,
      "base_battleground": true,
      "primary_region_id": "region.europe",
      "subregion_ids": [
        "region.western_europe"
      ],
      "source_refs": [
        {
          "source_id": "M-DELUXE",
          "locator": "Europe / Italy box: stability, battleground title, region colors",
          "verification": "Verified"
        }
      ]
    },
    {
      "id": "country.greece",
      "name_key": "country.greece.name",
      "stability": 2,
      "base_battleground": false,
      "primary_region_id": "region.europe",
      "subregion_ids": [
        "region.western_europe"
      ],
      "source_refs": [
        {
          "source_id": "M-DELUXE",
          "locator": "Europe / Greece box: stability, battleground title, region colors",
          "verification": "Verified"
        }
      ]